{
  "batch_id": "WA-PB01",
  "criteria": {
    "all_five_waves_present": true,
    "all_nesting_relationships_preserved_as_lists": true,
    "all_target_artifacts_have_sha256": true,
    "all_target_output_paths_are_unique": true,
    "all_targets_are_deterministic": true,
    "all_targets_generate_division_and_jurisdiction": true,
    "all_targets_match_government_classification": true,
    "all_targets_resolve_by_exact_maintained_ocdid": true,
    "all_wave_artifact_inventories_are_identical": true,
    "all_wave_criteria_pass": true,
    "all_wave_gates_pass": true,
    "all_waves_share_one_selection_crosswalk": true,
    "all_waves_share_one_upstream_revision": true,
    "complete_target_id_coverage": true,
    "no_duplicate_target_ids": true,
    "no_exceptions_or_review_reasons": true,
    "zero_target_only_production_patches": true
  },
  "crosswalk_sha256": "e5e9739380738142535040bd643225638f236706a684374c83d1178fc3a96d38",
  "rollup_id": "4cc54ecf8306a400d5a9",
  "schema_version": 1,
  "summary": {
    "artifact_hash_count": 210,
    "deterministic_count": 100,
    "exception_or_review_count": 0,
    "gate_passed": true,
    "nesting_parity_count": 100,
    "passed_count": 100,
    "target_artifact_count": 200,
    "target_count": 100,
    "target_only_patch_count": 0,
    "wave_count": 5,
    "wave_scoped_shared_artifact_count": 10
  },
  "targets": [
    {
      "census_geoid": "5333560",
      "jurisdiction_name": "Ione",
      "maintained_ocdid": "ocd-division/country:us/state:wa/place:ione",
      "status": "passed",
      "target_id": "WA-PB01-001",
      "wave": "WA-PB01-A"
    },
    {
      "census_geoid": "5333805",
      "jurisdiction_name": "Issaquah",
      "maintained_ocdid": "ocd-division/country:us/state:wa/place:issaquah",
      "status": "passed",
      "target_id": "WA-PB01-002",
      "wave": "WA-PB01-A"
    },
    {
      "census_geoid": "5334575",
      "jurisdiction_name": "Kahlotus",
      "maintained_ocdid": "ocd-division/country:us/state:wa/place:kahlotus",
      "status": "passed",
      "target_id": "WA-PB01-003",
      "wave": "WA-PB01-A"
    },
    {
      "census_geoid": "5334645",
      "jurisdiction_name": "Kalama",
      "maintained_ocdid": "ocd-division/country:us/state:wa/place:kalama",
      "status": "passed",
      "target_id": "WA-PB01-004",
      "wave": "WA-PB01-A"
    },
    {
      "census_geoid": "5335065",
      "jurisdiction_name": "Kelso",
      "maintained_ocdid": "ocd-division/country:us/state:wa/place:kelso",
      "status": "passed",
      "target_id": "WA-PB01-005",
      "wave": "WA-PB01-A"
    },
    {
      "census_geoid": "5335170",
      "jurisdiction_name": "Kenmore",
      "maintained_ocdid": "ocd-division/country:us/state:wa/place:kenmore",
      "status": "passed",
      "target_id": "WA-PB01-006",
      "wave": "WA-PB01-A"
    },
    {
      "census_geoid": "5335275",
      "jurisdiction_name": "Kennewick",
      "maintained_ocdid": "ocd-division/country:us/state:wa/place:kennewick",
      "status": "passed",
      "target_id": "WA-PB01-007",
      "wave": "WA-PB01-A"
    },
    {
      "census_geoid": "5335485",
      "jurisdiction_name": "Kettle Falls",
      "maintained_ocdid": "ocd-division/country:us/state:wa/place:kettle_falls",
      "status": "passed",
      "target_id": "WA-PB01-008",
      "wave": "WA-PB01-A"
    },
    {
      "census_geoid": "5335940",
      "jurisdiction_name": "Kirkland",
      "maintained_ocdid": "ocd-division/country:us/state:wa/place:kirkland",
      "status": "passed",
      "target_id": "WA-PB01-009",
      "wave": "WA-PB01-A"
    },
    {
      "census_geoid": "5336045",
      "jurisdiction_name": "Kittitas",
      "maintained_ocdid": "ocd-division/country:us/state:wa/place:kittitas",
      "status": "passed",
      "target_id": "WA-PB01-010",
      "wave": "WA-PB01-A"
    },
    {
      "census_geoid": "5336395",
      "jurisdiction_name": "Krupp",
      "maintained_ocdid": "ocd-division/country:us/state:wa/place:krupp",
      "status": "passed",
      "target_id": "WA-PB01-011",
      "wave": "WA-PB01-A"
    },
    {
      "census_geoid": "5336710",
      "jurisdiction_name": "La Center",
      "maintained_ocdid": "ocd-division/country:us/state:wa/place:la_center",
      "status": "passed",
      "target_id": "WA-PB01-012",
      "wave": "WA-PB01-A"
    },
    {
      "census_geoid": "5336745",
      "jurisdiction_name": "Lacey",
      "maintained_ocdid": "ocd-division/country:us/state:wa/place:lacey",
      "status": "passed",
      "target_id": "WA-PB01-013",
      "wave": "WA-PB01-A"
    },
    {
      "census_geoid": "5336780",
      "jurisdiction_name": "La Conner",
      "maintained_ocdid": "ocd-division/country:us/state:wa/place:la_conner",
      "status": "passed",
      "target_id": "WA-PB01-014",
      "wave": "WA-PB01-A"
    },
    {
      "census_geoid": "5336850",
      "jurisdiction_name": "LaCrosse",
      "maintained_ocdid": "ocd-division/country:us/state:wa/place:lacrosse",
      "status": "passed",
      "target_id": "WA-PB01-015",
      "wave": "WA-PB01-A"
    },
    {
      "census_geoid": "5337270",
      "jurisdiction_name": "Lake Forest Park",
      "maintained_ocdid": "ocd-division/country:us/state:wa/place:lake_forest_park",
      "status": "passed",
      "target_id": "WA-PB01-016",
      "wave": "WA-PB01-A"
    },
    {
      "census_geoid": "5337900",
      "jurisdiction_name": "Lake Stevens",
      "maintained_ocdid": "ocd-division/country:us/state:wa/place:lake_stevens",
      "status": "passed",
      "target_id": "WA-PB01-017",
      "wave": "WA-PB01-A"
    },
    {
      "census_geoid": "5338038",
      "jurisdiction_name": "Lakewood",
      "maintained_ocdid": "ocd-division/country:us/state:wa/place:lakewood",
      "status": "passed",
      "target_id": "WA-PB01-018",
      "wave": "WA-PB01-A"
    },
    {
      "census_geoid": "5338215",
      "jurisdiction_name": "Lamont",
      "maintained_ocdid": "ocd-division/country:us/state:wa/place:lamont",
      "status": "passed",
      "target_id": "WA-PB01-019",
      "wave": "WA-PB01-A"
    },
    {
      "census_geoid": "5338355",
      "jurisdiction_name": "Langley",
      "maintained_ocdid": "ocd-division/country:us/state:wa/place:langley",
      "status": "passed",
      "target_id": "WA-PB01-020",
      "wave": "WA-PB01-A"
    },
    {
      "census_geoid": "5338495",
      "jurisdiction_name": "Latah",
      "maintained_ocdid": "ocd-division/country:us/state:wa/place:latah",
      "status": "passed",
      "target_id": "WA-PB01-021",
      "wave": "WA-PB01-B"
    },
    {
      "census_geoid": "5338845",
      "jurisdiction_name": "Leavenworth",
      "maintained_ocdid": "ocd-division/country:us/state:wa/place:leavenworth",
      "status": "passed",
      "target_id": "WA-PB01-022",
      "wave": "WA-PB01-B"
    },
    {
      "census_geoid": "5339335",
      "jurisdiction_name": "Liberty Lake",
      "maintained_ocdid": "ocd-division/country:us/state:wa/place:liberty_lake",
      "status": "passed",
      "target_id": "WA-PB01-023",
      "wave": "WA-PB01-B"
    },
    {
      "census_geoid": "5339510",
      "jurisdiction_name": "Lind",
      "maintained_ocdid": "ocd-division/country:us/state:wa/place:lind",
      "status": "passed",
      "target_id": "WA-PB01-024",
      "wave": "WA-PB01-B"
    },
    {
      "census_geoid": "5340070",
      "jurisdiction_name": "Long Beach",
      "maintained_ocdid": "ocd-division/country:us/state:wa/place:long_beach",
      "status": "passed",
      "target_id": "WA-PB01-025",
      "wave": "WA-PB01-B"
    },
    {
      "census_geoid": "5340245",
      "jurisdiction_name": "Longview",
      "maintained_ocdid": "ocd-division/country:us/state:wa/place:longview",
      "status": "passed",
      "target_id": "WA-PB01-026",
      "wave": "WA-PB01-B"
    },
    {
      "census_geoid": "5340770",
      "jurisdiction_name": "Lyman",
      "maintained_ocdid": "ocd-division/country:us/state:wa/place:lyman",
      "status": "passed",
      "target_id": "WA-PB01-027",
      "wave": "WA-PB01-B"
    },
    {
      "census_geoid": "5340805",
      "jurisdiction_name": "Lynden",
      "maintained_ocdid": "ocd-division/country:us/state:wa/place:lynden",
      "status": "passed",
      "target_id": "WA-PB01-028",
      "wave": "WA-PB01-B"
    },
    {
      "census_geoid": "5340840",
      "jurisdiction_name": "Lynnwood",
      "maintained_ocdid": "ocd-division/country:us/state:wa/place:lynnwood",
      "status": "passed",
      "target_id": "WA-PB01-029",
      "wave": "WA-PB01-B"
    },
    {
      "census_geoid": "5340980",
      "jurisdiction_name": "Mabton",
      "maintained_ocdid": "ocd-division/country:us/state:wa/place:mabton",
      "status": "passed",
      "target_id": "WA-PB01-030",
      "wave": "WA-PB01-B"
    },
    {
      "census_geoid": "5341225",
      "jurisdiction_name": "McCleary",
      "maintained_ocdid": "ocd-division/country:us/state:wa/place:mccleary",
      "status": "passed",
      "target_id": "WA-PB01-031",
      "wave": "WA-PB01-B"
    },
    {
      "census_geoid": "5342275",
      "jurisdiction_name": "Malden",
      "maintained_ocdid": "ocd-division/country:us/state:wa/place:malden",
      "status": "passed",
      "target_id": "WA-PB01-032",
      "wave": "WA-PB01-B"
    },
    {
      "census_geoid": "5342800",
      "jurisdiction_name": "Mansfield",
      "maintained_ocdid": "ocd-division/country:us/state:wa/place:mansfield",
      "status": "passed",
      "target_id": "WA-PB01-033",
      "wave": "WA-PB01-B"
    },
    {
      "census_geoid": "5343150",
      "jurisdiction_name": "Maple Valley",
      "maintained_ocdid": "ocd-division/country:us/state:wa/place:maple_valley",
      "status": "passed",
      "target_id": "WA-PB01-034",
      "wave": "WA-PB01-B"
    },
    {
      "census_geoid": "5343395",
      "jurisdiction_name": "Marcus",
      "maintained_ocdid": "ocd-division/country:us/state:wa/place:marcus",
      "status": "passed",